{
  "kind": "notes",
  "subjectCode": "HIST",
  "topic": "Sardar Patel & Subhas Chandra Bose",
  "items": [
    {
      "id": "hist-modern-patel-bose-note-patel-rise",
      "subjectCode": "HIST",
      "subtopicId": "hist-modern-patel-bose",
      "title": "Patel: From Barrister to 'Sardar'",
      "body": "**In one line** — How a successful lawyer gave up his career for the freedom struggle and, through two peasant movements, became 'Sardar' (the leader).\n\n**Why it is asked** — Examiners love the *order* of Patel's two satyagrahas (Kheda before Bardoli) and the fact that the title 'Sardar' came from Bardoli, not Kheda.\n\n## The story\n\n- **Who:** **Vallabhbhai Patel** (born 1875, Nadiad, Gujarat) trained as a **barrister** (a courtroom lawyer) in London and built a thriving practice in **Ahmedabad**.\n- **Turning point:** inspired by **Gandhi**, he gave up his legal career to join the national movement.\n- **Kheda Satyagraha (1918):** his first mass campaign, with Gandhi. When crops failed and plague struck, the government still demanded full land revenue; Patel organised the Kheda peasants to **refuse payment** until relief was given. ('Satyagraha' = Gandhi's method of non-violent resistance.)\n- **Bardoli Satyagraha (1928):** the government raised land revenue in Bardoli (Surat district) by about **22%**. Patel led a **disciplined no-tax campaign**; the peasants held firm, and the government was forced to **roll back the hike and return seized land**.\n- **Result:** the grateful women of Bardoli gave Patel the title **'Sardar'** (chief/leader), and the victory made him a national figure and the Congress's master organiser.\n\n## Picture it (timeline)\n\n| Year | Campaign | Result |\n|---|---|---|\n| 1918 | Kheda Satyagraha | First mass campaign with Gandhi |\n| 1928 | Bardoli Satyagraha | Revenue hike rolled back → title 'Sardar' |\n\n## Terms explained\n\n- **Barrister** — a lawyer qualified to argue cases in higher courts.\n- **Satyagraha** — Gandhi's non-violent resistance based on truth and moral pressure.\n- **Land revenue** — the tax farmers paid to the government on their land.\n- **Sardar** — 'chief' or 'leader'; Patel's lifelong honorific.\n\n**Don't confuse** — the title **'Sardar' came from Bardoli (1928)**, NOT from Kheda (1918); Kheda was merely his first campaign.\n\n**Remember it** — 'KB': **K**heda (1918) came before **B**ardoli (1928), and Bardoli made him Sardar.\n\n**TL;DR**\n\n- Patel: London-trained barrister who joined the struggle under Gandhi.\n- Kheda (1918) = first mass campaign; Bardoli (1928) = no-tax win → title 'Sardar'.\n- Became the Congress's chief organiser and disciplinarian.",
      "keyPoints": [
        "Vallabhbhai Patel (b. 1875, Nadiad) was a London-trained barrister who joined the struggle under Gandhi.",
        "Kheda Satyagraha (1918) was his first mass campaign against land revenue during crop failure.",
        "Bardoli Satyagraha (1928) forced a rollback of a ~22% revenue hike.",
        "The women of Bardoli gave him the title 'Sardar' after the 1928 success.",
        "He was the Congress's foremost organiser and disciplinarian."
      ],
      "mnemonic": "Order of Patel's campaigns: 'KB' = Kheda (1918) before Bardoli (1928).",
      "source": "NCERT & Britannica — Vallabhbhai Patel; Kheda & Bardoli Satyagrahas",
      "verified": true,
      "tags": [
        "patel",
        "bardoli",
        "kheda",
        "early-life"
      ]
    },
    {
      "id": "hist-modern-patel-bose-note-integration",
      "subjectCode": "HIST",
      "subtopicId": "hist-modern-patel-bose",
      "title": "Iron Man: Integration of the Princely States",
      "body": "**In one line** — How Patel persuaded and pressured about 565 princely kingdoms to join India in 1947, saving the country from breaking into pieces.\n\n**Why it is asked** — The number (~565 states), the tool (Instrument of Accession), and the duo (Patel + V.P. Menon) are high-frequency one-mark facts.\n\n## The story\n\n- **The problem:** when the British left in 1947, their **paramountcy** (overlordship over the princely states) **lapsed**. This left about **565 princely states** legally free to join **India**, join **Pakistan**, or stay **independent**. If many had stayed out, India would have been a patchwork full of holes — 'balkanisation'.\n- **The machinery:** Patel headed the new **States Department** (set up July 1947), with **V.P. Menon** as his Secretary. He used a mix of **persuasion, appeals to patriotism, and firmness** to bring the rulers in.\n- **The main tool — the Instrument of Accession:** a legal document by which a ruler handed over only **three subjects** to the Indian Union — **defence, external affairs and communications** — keeping internal matters for now. A **Standstill Agreement** kept existing arrangements running smoothly.\n- **The sweetener:** rulers who joined were promised **privy purses** (annual government payments) and the right to keep their titles and privileges — these were finally **abolished in 1971**.\n- **Result:** by 15 August 1947 the great majority had signed; only three hold-outs (Junagadh, Hyderabad, Kashmir) remained, settled by 1948–49. For this, Patel earned the titles **'Iron Man of India'** and **'Bismarck of India'** (after the statesman who unified Germany).\n\n## Picture it\n\n```\nBritish leave 1947 → paramountcy LAPSES → ~565 states free\n        |\nPatel + V.P. Menon (States Dept) → Instrument of Accession\n        |                                   (defence + external affairs + communications)\n   most states join by 15 Aug 1947 → only 3 hold-outs left\n```\n\n## Terms explained\n\n- **Paramountcy** — the supreme overlordship the British Crown held over the princely states.\n- **Instrument of Accession** — the legal deed by which a state joined India, ceding defence, external affairs and communications.\n- **Standstill Agreement** — a stop-gap deal to keep existing administrative links running.\n- **Privy purse** — an annual payment promised to a former ruler (abolished 1971).\n\n**Don't confuse** — the Instrument of Accession transferred **only three subjects** at first, not full control; and 'Bismarck of India' refers to *unification*, not to any German link.\n\n**Remember it** — 'Patel + Menon handed each raja a 3-subject form (defence, foreign affairs, communications).'\n\n**TL;DR**\n\n- 1947: ~565 states free to join India/Pakistan or stay independent.\n- Patel (States Dept) + V.P. Menon used persuasion + firmness.\n- Instrument of Accession ceded defence, external affairs, communications; privy purses promised (abolished 1971).\n- Earned Patel 'Iron Man' / 'Bismarck of India'.",
      "keyPoints": [
        "About 565 princely states were free to join India, join Pakistan, or stay independent in 1947.",
        "Patel headed the States Department (1947), assisted by Secretary V.P. Menon.",
        "The Instrument of Accession ceded defence, external affairs and communications to the Union.",
        "Acceding rulers were promised privy purses (abolished in 1971).",
        "Patel's success earned him the titles 'Iron Man' and 'Bismarck' of India."
      ],
      "source": "NCERT 'Politics in India Since Independence' & Britannica — integration of princely states",
      "verified": true,
      "tags": [
        "patel",
        "princely-states",
        "menon",
        "instrument-of-accession"
      ]
    },
    {
      "id": "hist-modern-patel-bose-note-three-hard-cases",
      "subjectCode": "HIST",
      "subtopicId": "hist-modern-patel-bose",
      "title": "The Three Hard Cases: Junagadh, Hyderabad, Kashmir",